{"$schema":"https://json-schema.org/draft/2020-12/schema","title":"Resolved Pricing Snapshot V0.1","type":"object","additionalProperties":false,"required":["schema_version","record_type","snapshot_ref","authority","provider","model","model_class","billing_mode","snapshot_version","snapshot_timestamp","freshness_status","currency","billing_unit_tokens","prices","metadata"],"properties":{"schema_version":{"const":"0.1"},"record_type":{"const":"RESOLVED_PRICING_SNAPSHOT"},"snapshot_ref":{"type":"string"},"authority":{"const":"03-01 AI资产成本"},"provider":{"type":"string"},"model":{"type":"string"},"model_class":{"type":"string"},"billing_mode":{"const":"API_TOKEN_BILLED"},"snapshot_version":{"type":"string"},"snapshot_timestamp":{"type":"string","format":"date-time"},"freshness_status":{"enum":["CURRENT","STALE","UNKNOWN"]},"currency":{"type":"string"},"billing_unit_tokens":{"type":"integer","minimum":1},"prices":{"type":"object","additionalProperties":false,"required":["input","cached_input","output","reasoning"],"properties":{"input":{"type":["string","null"]},"cached_input":{"type":["string","null"]},"output":{"type":["string","null"]},"reasoning":{"type":["string","null"]}}},"metadata":{"type":"object"}}}